Document_Name,Chapter,Section,SubSection,Paragraph_Synopsis,Sentence_Count,Additional_Context,Header,Footer,Indexed_Text,Table_Delimited,Hyperlinks
implementing-accounting-hub,4,FAQs for Manage Accounting and Reporting Sequences,Regulation Requirements Example,"Create a rule that automatically approves journals of 500 or less for a specific ledger, also approving journal batches for all other ledgers. The rule must cover all conditions to avoid errors.",15,Tips,Chapter 4 | Implementing Accounting Hub | Ledgers | Oracle Fusion Cloud Financials,61,"Create a Rule That Automatically Approves Journals Create the rule that automatically approves journals that are 500 or less for a specific ledger. The rule must also ensure that journal batches for all other ledgers are automatically approved as well. CAUTION: It's very important that the rules in a rule set cover all conditions and are collectively exhaustive. If not, errors might occur. 1. Select the first rule. 2. Click the list on the Cut icon and select Copy . 3. Click the list on the Cut icon and select Paste . The third rule appears after the first rule. 4. Click in the Rule Name field and rename the third rule to Less than 500. 5. Click the Expand",,
implementing-accounting-hub,4,FAQs for Manage Accounting and Reporting Sequences,Regulation Requirements Example,"Create a new rule with a condition grouping two existing conditions together using parentheses, then modify the operator to ""same or less than"" and set the value to 500. Add another condition to cover other batches without journals for the specified ledger.",16,Instruction,Chapter 4 | Implementing Accounting Hub | Ledgers | Oracle Fusion Cloud Financials,61,"icon to open the new rule. 6. Create a condition for journals 500 or less in the specified ledger by first grouping the two existing conditions together. In the IF section, click both conditions to select them. 7. Click the Surround selected tests with parenthesis icon. Both conditions are now enclosed within a set of parentheses. 8. Click in the Operator field of the second condition and select same or less than from the list. The amount automatically changes to 500. 9. Now add another condition to cover all of the other batches that don't have journals for the specified ledger. Click the Add simple test icon. A third condition row is added after the two grouped conditions. 10. Since",,
implementing-accounting-hub,4,FAQs for Manage Accounting and Reporting Sequences,Regulation Requirements Example,"Click the connector to change it from ""and"" to ""or"", then set up a new condition by selecting ""Name"" under ""Maximum Journal Amount"" and specifying an operator (""isn't"") with a right value (ledger name).",18,Instruction,Chapter 4 | Implementing Accounting Hub | Ledgers | Oracle Fusion Cloud Financials,61,"this new condition is mutually exclusive to the grouped conditions, click the connector to change it from and to or . 11. Click the Left Value icon. The Condition Browser window opens. 12. Expand the Maximum Journal Amount folder and select Name . 13. Click OK . The Condition Browser window closes. 14. Click in the Operator field and select the operator named isn't. 15. In the Right Value field, enter the name of the ledger in quotation marks. 16. Now set up the automatic approval. The Supervisory list builder has two parameters that override the supervisory approval and return a preconfigured approval action. In the THEN section, click in the Auto Action Enabled field, and select True . 17.",,
implementing-accounting-hub,4,FAQs for Manage Accounting and Reporting Sequences,Regulation Requirements Example,"Enter ""APPROVE"" in the Auto Action field, then collapse the rule, defining three rules that collectively exhaustively meet business requirements. Deploy the rules by clicking Commit Task and entering comments to route journal batches for approval accordingly.",14,Tips,Chapter 4 | Implementing Accounting Hub | Ledgers | Oracle Fusion Cloud Financials,61,"In the Auto Action field, enter ""APPROVE"". Include the quotation marks. 18. Collapse the rule. You have now defined three rules that meet the business requirements and are collectively exhaustive. All journal batches satisfy the conditions in at least one of the three rules and are routed for approval accordingly. If a journal batch doesn't satisfy the conditions in at least one rule within a rule set, the rule evaluation process would fail with errors. 19. Deploy the rules so that they can be used. On the Tasks to be configured toolbar, click the Commit Task icon. The Enter Comments window opens. 20. Click OK . The Enter Comments window closes and a message appears stating that the data rule",,
implementing-accounting-hub,4,FAQs for Manage Accounting and Reporting Sequences,Regulation Requirements Example,"Journal approval has been saved and committed. Journal batches are now submitted for approval according to defined rules, allowing for policy-driven approval workflows.",5,Note,Chapter 4 | Implementing Accounting Hub | Ledgers | Oracle Fusion Cloud Financials,61,"has been saved and committed. 21. Click OK . After journal approval is enabled, journal batches being posted are submitted for approval based on these rules. Considerations for Defining Journal Approval Rules Use approval management to define policies that apply to the journal approval workflow.",,
implementing-accounting-hub,4,FAQs for Manage Accounting and Reporting Sequences,Regulation Requirements Example,"A predefined approval rule exists for journal approval, which sends the journal to the supervisor of the submitter for a single level of approval. You can configure journal approval rules in the Business Process Management Worklist application.",4,Definition,Chapter 4 | Implementing Accounting Hub | Ledgers | Oracle Fusion Cloud Financials,62,"Rule Definition Consideration One predefined approval rule exists for journal approval. If a journal's ledger and source are enabled for approval, then that journal is sent for one level of approval to the supervisor of the person who submitted the journal for approval. You can configure journal approval rules in the Business Process Management Worklist application. Open the application by selecting the Notifications icon on the home page and clicking More Details or, by using the following in the Setup and Maintenance work area: - Offering: Financials - Functional Area: Application Extensions - Task: Manage Task Configurations for Financials For a simple approval scenario, start by defining one or all of the following journal approval rules based on: - The","Condition
Approval Action
Less than 50,000 USD
No approval required
Between 50,000 and 100,000 USD
One level of approval required
Greater than 100,000 USD
Two levels of approval required",
implementing-accounting-hub,4,FAQs for Manage Accounting and Reporting Sequences,Regulation Requirements Example,"The highest journal line amount per ledger per batch determines the stage in the period close process, with conditions and approval actions routing a journal approval based on maximum amounts (e.g., no approval required for < $50,000). Rules can be customized for combinations of factors.",7,Definition,Chapter 4 | Implementing Accounting Hub | Ledgers | Oracle Fusion Cloud Financials,62,"highest journal line amount per ledger per batch. - The highest journal amount per ledger per batch. - Your stage in the period close process. For example, are you in the beginning, middle, or end of the month, or in preclose, close, post close, or quarter close process? The following table provides an example of rule conditions and approval actions that route a journal approval based on maximum journal line amounts. Condition Approval Action Less than 50,000 USD No approval required Between 50,000 and 100,000 USD One level of approval required Greater than 100,000 USD Two levels of approval required You can build your rules for combinations of ledger, entered amount, approval level, or other scenarios. In addition, you can",,
implementing-accounting-hub,4,FAQs for Manage Accounting and Reporting Sequences,Regulation Requirements Example,"Rules can be defined based on attributes from different parts of a journal, such as category or source information. The approval task is then assigned to other approvers or routed to the manager of the submitter, with list builders used to generate the required approver list.",6,Definition,Chapter 4 | Implementing Accounting Hub | Ledgers | Oracle Fusion Cloud Financials,62,"define rules based on attributes from different parts of your journal, including the ledger, batch, header, or line level. For example, you can use category, source, account, or descriptive flexfield information as selection criteria for journal approval. Note: To prevent a submitter from approving their own journal batch, select the Skip creator for Approval List check box on the Configuration page in the Worklist application. The approval task is then assigned to other approvers or automatically routed to the manager of the submitter. Approvals List Builder Considerations List builders are the way approvals management builds the list of approvers required for a transaction based on the rule condition. Each approval rule is associated with a list builder for generating the",,
implementing-accounting-hub,4,FAQs for Manage Accounting and Reporting Sequences,Regulation Requirements Example,"The List Builder uses HCM-defined job levels and supervisors to generate approval lists, with employees reporting to those with higher job levels and supervisors. The process continues until an approver with a sufficient job level is found, based on the starting position specified in the rule.",8,Overview,Chapter 4 | Implementing Accounting Hub | Ledgers | Oracle Fusion Cloud Financials,63,"List Builder Description Supervisory Based on the employee supervisory hierarchy, which is defined in HCM. Employees must be set up with appropriate jobs and supervisors. For example, a clerk reports to a manager, who reports to the director. Job Level Based on the job level, which is defined in HCM. Employees must be set up with the appropriate job levels and supervisors. For example, a job level 1 employee, a clerk, reports to a job level 2 employee, a manager, who reports to a job level 4 employee, a director. The approval list is generated based on the starting position specified in the rule and continues until an approver with a sufficient job level is found. The supervisory hierarchy must","List Builder
Description
Supervisory
Based on the employee supervisory hierarchy, which is defined in HCM. Employees must be set up
with appropriate jobs and supervisors. For example, a clerk reports to a manager, who reports to the
director.
Job Level
Based on the job level, which is defined in HCM. Employees must be set up with the appropriate job
levels and supervisors.
For example, a job level 1 employee, a clerk, reports to a job level 2 employee, a manager, who
reports to a job level 4 employee, a director. The approval list is generated based on the starting
position specified in the rule and continues until an approver with a sufficient job level is found. The
supervisory hierarchy must be defined along with the corresponding job levels.
Position
Based on the position hierarchy, which is defined in HCM. The position hierarchy must be defined and
employees must be assigned the corresponding positions. Use this hierarchy if you need a hierarchy
that's different from the supervisory hierarchy, or multiple hierarchies selected based on different
attributes.
Approval Group
Consists of a static predefined set of users configured to act on a task. For example, you can create
an approval group called Finance Group, consisting of users from the finance department who must
participate in the task approval.
Resource
Builds the approvers list by using a specific user, enterprise group or application role.",
implementing-accounting-hub,4,FAQs for Manage Accounting and Reporting Sequences,Regulation Requirements Example,"Oracle HCM defines positions and job levels, which are used to assign employees to roles. Approval groups consist of pre-defined users configured to approve tasks, while resources build approver lists using specific users, enterprise groups, or application roles.",8,Tips,Chapter 4 | Implementing Accounting Hub | Ledgers | Oracle Fusion Cloud Financials,63,"be defined along with the corresponding job levels. Position Based on the position hierarchy, which is defined in HCM. The position hierarchy must be defined and employees must be assigned the corresponding positions. Use this hierarchy if you need a hierarchy that's different from the supervisory hierarchy, or multiple hierarchies selected based on different attributes. Approval Group Consists of a static predefined set of users configured to act on a task. For example, you can create an approval group called Finance Group, consisting of users from the finance department who must participate in the task approval. Resource Builds the approvers list by using a specific user, enterprise group or application role. Other Considerations Other functionality to consider before defining approval",,
implementing-accounting-hub,4,FAQs for Manage Accounting and Reporting Sequences,Regulation Requirements Example,"To enable approval process, both ledger and journal sources must be enabled. Approval applies to entire journal batch, not individual attributes, and journals requiring approval are routed for approval before posting.",9,Instruction,Chapter 4 | Implementing Accounting Hub | Ledgers | Oracle Fusion Cloud Financials,63,"rules. - Both the ledger and journal source must be enabled for the approval process. CAUTION: You should not enable journal approval for journals that come from subledgers (with subledger journal sources). Otherwise, if a journal from a subledger isn't approved, the journal can get stuck in the approval process. For any subledger journal sources, approvals for subledger transactions should be done in the subledgers themselves. - Approval is for the entire journal batch, regardless of the attributes used in the approval rules. - If a journal requires approval, submitting a journal for posting automatically routes the journal for approval before posting. - A journal can be escalated to an approver by the administrator. - The task initiator can select",,
implementing-accounting-hub,4,FAQs for Manage Accounting and Reporting Sequences,Regulation Requirements Example,"You can withdraw a journal's approval at any time, which sets its completion status to ""Incomplete"" and allows editing before resubmitting for approval again. The Journals page displays a list of journals requiring your approval, pending approval from others, or awaiting your approval/rejection as the current approver.",8,Instruction,Chapter 4 | Implementing Accounting Hub | Ledgers | Oracle Fusion Cloud Financials,63,"Withdraw Approval on the Journals page at any time in the approval process to withdraw journals from the process. Clicking this button enables editing of the journal. After your changes are made, submit the entry for approval again. When a journal is withdrawn, the completion status is set to Incomplete. - Approval notifications display a table of key journal attributes for each journal and a list of past, current, and future approvers. - The Journals work area displays journals requiring your approval and journals pending approval from others. - If you're the current approver, the Journals page shows the journals to be approved or rejected. - Allocation journals aren't routed through the approval process.",,
implementing-accounting-hub,4,AutoPost Criteria Sets,Regulation Requirements Example,"You can review journal batch details on online and email notifications, including journals and lines included in the batch.",7,Overview,Chapter 4 | Implementing Accounting Hub | Ledgers | Oracle Fusion Cloud Financials,64,"- You can review the details of the journals and journal lines included in a journal batch on the online and email journal batch approval notifications. Related Topics - How do I update existing setup data? - Overview of Notifications and Approval Workflows - Configure Workflow Approvals and Notifications AutoPost Criteria Sets Create an AutoPost Criteria Set In this example, you're creating an AutoPost criteria set to post the general ledger journal entries created by journal import for your subledger transactions. Here's the relevant setup for your Vision Corporation ledger. - You implemented Oracle General Ledger and the subledgers Oracle Payables and Oracle Receivables. - You use a non-Oracle subledger called Fast Assets for fixed asset tracking and depreciation. -",,
implementing-accounting-hub,4,AutoPost Criteria Sets,Regulation Requirements Example,"You plan to automate general ledger journal batch postings from subledgers to prevent edits/deletions causing out-of-balance situations. Use the ""All"" option for category and accounting period, create criteria sets by source (if needed), and define a set that posts entries for all ledgers.",6,Overview,Chapter 4 | Implementing Accounting Hub | Ledgers | Oracle Fusion Cloud Financials,64,You plan to automate posting of general ledger journal batches created by journal import. The automation is to protect the subledger-sourced journal entries from edits or deletion that could cause an out-of-balance situation between the subledgers and general ledger. Consider these points when creating a criteria set: - Use the All option for category and accounting period to reduce maintenance and ensure that all journal imports are included in the posting process. - Create a criteria set that includes all your subledger sources. Create multiple criteria sets by source only if you must schedule different posting times to balance close activities or reduce processing time. - Define a criteria set that posts journal entries for all ledgers by selecting All,,
implementing-accounting-hub,4,AutoPost Criteria Sets,Regulation Requirements Example,"Create an AutoPost Criteria Set named ""All Journal Imported Entries"" with the description ""Posting journals imported from the subledgers"". Enable the set to allow journal entries to be posted for all ledgers within that user's assigned data access sets.",11,Note,Chapter 4 | Implementing Accounting Hub | Ledgers | Oracle Fusion Cloud Financials,64,"in the Ledger or Ledger Set field. When a user submits the AutoPost Journals process, the process posts journal entries for all ledgers in that users assigned data access sets. Create the Set 1. Go to the following: Offering: Financials Functional Area: General Ledger Task: Manage AutoPost Criteria Sets 2. Click Create . 3. Enter this name: All Journal Imported Entries. 4. Enter this description: Posting journals imported from the subledgers. 5. Select Enabled .",,How do I update existing setup data? | https://www.oracle.com/pls/topic/lookup?ctx=fa25b&id=s20051179; Overview of Notifications and Approval Workflows | https://www.oracle.com/pls/topic/lookup?ctx=fa25b&id=s20030145; Configure Workflow Approvals and Notifications | https://www.oracle.com/pls/topic/lookup?ctx=fa25b&id=s20078349
implementing-accounting-hub,4,AutoPost Criteria Sets,Regulation Requirements Example,"To keep the batch creator as the submitter for approval when AutoPost Journals runs, select the ""Use Batch Creator as Approval Submitter"" checkbox. Enter values for each new line, including priority ledger, source category, accounting period, balance type, and number of days before processing all criteria (30 days).",7,Tips,Chapter 4 | Implementing Accounting Hub | Ledgers | Oracle Fusion Cloud Financials,65,"6. Select the Use Batch Creator as Approval Submitter check box if you require keeping the creator of the journal batch as the user who submitted the batch for approval when the AutoPost Journals process runs. If you don't select this check box, the user running the AutoPost journals process is the submitter for approval. 7. Enter these values and click Add Row to add each new line. Priority Ledger or Ledger Set Source Category Accounting Period Balance Type 1 Vision Corporation Payables All All All 2 Vision Corporation Receivables All All All 3 Vision Corporation Fast Assets All All All 8. Select Yes for the Process All Criteria check box, and enter 30 as the number of days before","Priority
Ledger or Ledger
Set
Source
Category
Accounting Period
Balance Type
1
Vision Corporation
Payables
All
All
All
2
Vision Corporation
Receivables
All
All
All
3
Vision Corporation
Fast Assets
All
All
All
Error
Cause
Solution
Unopened accounting period
The journal import was imported into a future
period. An error arises when the AutoPost
Open the period.",
implementing-accounting-hub,4,AutoPost Criteria Sets,Regulation Requirements Example,"To automate the posting process, create an AutoPost criteria set and schedule the AutoPost Journals process to run regularly after importing journals from subledgers. This can be done during nonpeak times to conserve resources and prevent changes to the journals.",9,Tips,Chapter 4 | Implementing Accounting Hub | Ledgers | Oracle Fusion Cloud Financials,65,"and after the submission date. The process runs less often when you specify a wide range. 9. Click Save and Close . Tip: Schedule the process to run immediately after the Import Journals process to prevent changes to the journals. Run the process during nonpeak times to save resources. Related Topics - How can I run the AutoPost process? - Examples of Manually Running the AutoPost Process - Submit Scheduled Processes and Process Sets Examples of Manually Running the AutoPost Process Create an AutoPost criteria set and schedule the AutoPost Journals process to run on a regular basis following your scheduled journal imports from your subledgers. When errors occur that prevent posting of the journal imports, you must correct the",,
implementing-accounting-hub,4,AutoPost Criteria Sets,Regulation Requirements Example,"The AutoPost process may encounter errors, such as an unopened accounting period, which prevents journal batches from posting. To resolve this error, open the period to allow the import into the correct accounting period.",5,Note,Chapter 4 | Implementing Accounting Hub | Ledgers | Oracle Fusion Cloud Financials,65,errors and manually run the AutoPost process. The following scenarios illustrate the kinds of errors that could occur and how you can resolve these errors. Scenario The following table lists the errors that prevented journal batches from posting when the scheduled AutoPost Journals process ran. Error Cause Solution Unopened accounting period The journal import was imported into a future period. An error arises when the AutoPost Open the period.,,Submit Scheduled Processes and Process Sets | https://www.oracle.com/pls/topic/lookup?ctx=fa25b&id=s20048442
implementing-accounting-hub,4,FAQs for Manage AutoPost Criteria Sets,Regulation Requirements Example,"The Journals process fails to post transactions due to invalid or missing journals, causing the import from the general ledger interface table to fail. To resolve this, correct the error that caused the failure or revise the posting criteria to allow journal batches to be posted.",10,Tips,Chapter 4 | Implementing Accounting Hub | Ledgers | Oracle Fusion Cloud Financials,66,Error Cause Solution Journals process runs on a schedule because journals can't be posted in a future period. Invalid or no journals Journal import fails to import transactions from the general ledger interface table. The AutoPost Journals process runs on schedule but finds no batches to post. The posting process doesn't run and the AutoPost Execution report shows that no batches matched the criteria. Correct the error that caused the journal import to fail. Invalid or no journals No journals were selected based on the posting criteria. Journal batches are available for posting. The posting process doesn't run and the AutoPost Execution report shows that no batches matched the criteria. Revise the criteria set. After you correct the errors: -,"Error
Cause
Solution
Journals process runs on a schedule because
journals can't be posted in a future period.
Invalid or no journals
Journal import fails to import transactions from
the general ledger interface table. The AutoPost
Journals process runs on schedule but finds no
batches to post. The posting process doesn't
run and the AutoPost Execution report shows
that no batches matched the criteria.
Correct the error that caused the journal import
to fail.
Invalid or no journals
No journals were selected based on the posting
criteria. Journal batches are available for
posting. The posting process doesn't run and
the AutoPost Execution report shows that no
batches matched the criteria.
Revise the criteria set.",
